{
  "format": "svm.combat/1",
  "id": "combat.rifle-auto-crouch-walking",
  "title": "Merc rifle on full auto while crouch-walking forward (the speed term of the spread)",
  "map": "SteeE",
  "mode": "playlevel",
  "local": {
    "team": "merc",
    "floor": [
      -492.0,
      -2032.0,
      -1143.5
    ],
    "yaw": 16384,
    "crouched": true
  },
  "target": null,
  "settleFrames": 30,
  "durationFrames": 220,
  "events": [
    {
      "frame": 0,
      "do": "rof",
      "mode": "auto"
    },
    {
      "frame": 2,
      "do": "aimPoint",
      "point": [
        -492.0,
        2000.0,
        -1000.0
      ]
    },
    {
      "frame": 3,
      "do": "buttons",
      "buttons": {
        "BT_Up": 1
      }
    },
    {
      "frame": 40,
      "do": "fire"
    },
    {
      "frame": 160,
      "do": "fireUp"
    },
    {
      "frame": 170,
      "do": "buttons",
      "buttons": {
        "BT_Up": 0
      }
    }
  ],
  "repeats": 2,
  "measure": {
    "shots": {}
  },
  "covers": [
    "uc:SBase.SPlayerController:Fire",
    "uc:SBase.SWeaponDefense:FireWeapon",
    "uc:SBase.SWeaponDefense:ServerFireWeapon",
    "uc:SBase.SWeaponDefense:TraceFire",
    "nat:Engine.Actor.TraceBone",
    "nat:SBase.SWeaponDefense.GetAccuracy",
    "uc:SBase.SPlayerController:StandardReactionsToDamage",
    "uc:SBase.SPlayerController:PawnTakeDamage"
  ],
  "spot": "SteeE east yard lane (x -492, floor z -1143.5, clear for 1792 uu along +Y from y -2032; found with re/tools/difftest/spots.py for the R4 locomotion recordings)"
}
