{
  "format": "svm.combat/1",
  "id": "combat.shock-merc-head",
  "title": "A spy's shocker hits the local merc in the head",
  "map": "SteeE",
  "mode": "playlevel",
  "local": {
    "team": "merc",
    "floor": [
      -492.0,
      -2032.0,
      -1143.5
    ],
    "yaw": 16384,
    "crouched": false
  },
  "target": {
    "team": "spy",
    "floor": [
      -492.0,
      -1832.0,
      -1143.5
    ],
    "yaw": 49152,
    "crouched": false
  },
  "order": 90,
  "settleFrames": 30,
  "durationFrames": 1150,
  "events": [
    {
      "frame": 30,
      "do": "targetFire",
      "bone": "head",
      "note": "the target spy's shocker, server side"
    },
    {
      "frame": 100,
      "do": "aimPoint",
      "point": [
        -492.0,
        2000.0,
        -1000.0
      ]
    },
    {
      "frame": 120,
      "do": "fire"
    },
    {
      "frame": 121,
      "do": "fireUp"
    },
    {
      "frame": 270,
      "do": "fire"
    },
    {
      "frame": 271,
      "do": "fireUp"
    },
    {
      "frame": 400,
      "do": "fire"
    },
    {
      "frame": 401,
      "do": "fireUp"
    },
    {
      "frame": 500,
      "do": "targetFire",
      "bone": "head",
      "note": "inside the immunity: refused"
    },
    {
      "frame": 860,
      "do": "targetFire",
      "bone": "head",
      "note": "after the immunity"
    }
  ],
  "repeats": 2,
  "measure": {
    "shock": {
      "victim": "L"
    },
    "states": {}
  },
  "covers": [
    "uc:SBase.SPlayerController:Checkshock",
    "uc:SBase.SPlayerController:ClientStickyShock",
    "uc:SBase.SPlayerController:PlayerTick",
    "uc:SBase.SWeaponAttaque:TraceFireWithPos"
  ],
  "spot": "SteeE east yard lane (x -492, floor z -1143.5, clear for 1792 uu along +Y from y -2032; found with re/tools/difftest/spots.py for the R4 locomotion recordings)",
  "notes": "The target spy fires its shocker through ServerFireWeaponWithLocation from its eye at the local player's bone (what its client would ask the server); the local player runs the freeze, the electric time and the immunity as a player does."
}
