{
  "format": "svm.combat/1",
  "id": "combat.rifle-single-spread",
  "title": "Merc rifle single shots every 0.25 s down the lane (each spawns a tracer: the spread and the aim kick per shot)",
  "map": "SteeE",
  "mode": "playlevel",
  "local": {
    "team": "merc",
    "floor": [
      -492.0,
      -2032.0,
      -1143.5
    ],
    "yaw": 16384,
    "crouched": false
  },
  "target": null,
  "settleFrames": 30,
  "durationFrames": 240,
  "events": [
    {
      "frame": 0,
      "do": "rof",
      "mode": "single"
    },
    {
      "frame": 2,
      "do": "aimPoint",
      "point": [
        -492.0,
        2000.0,
        -1000.0
      ]
    },
    {
      "frame": 10,
      "do": "fire"
    },
    {
      "frame": 11,
      "do": "fireUp"
    },
    {
      "frame": 25,
      "do": "fire"
    },
    {
      "frame": 26,
      "do": "fireUp"
    },
    {
      "frame": 40,
      "do": "fire"
    },
    {
      "frame": 41,
      "do": "fireUp"
    },
    {
      "frame": 55,
      "do": "fire"
    },
    {
      "frame": 56,
      "do": "fireUp"
    },
    {
      "frame": 70,
      "do": "fire"
    },
    {
      "frame": 71,
      "do": "fireUp"
    },
    {
      "frame": 85,
      "do": "fire"
    },
    {
      "frame": 86,
      "do": "fireUp"
    },
    {
      "frame": 100,
      "do": "fire"
    },
    {
      "frame": 101,
      "do": "fireUp"
    },
    {
      "frame": 115,
      "do": "fire"
    },
    {
      "frame": 116,
      "do": "fireUp"
    },
    {
      "frame": 130,
      "do": "fire"
    },
    {
      "frame": 131,
      "do": "fireUp"
    },
    {
      "frame": 145,
      "do": "fire"
    },
    {
      "frame": 146,
      "do": "fireUp"
    },
    {
      "frame": 160,
      "do": "fire"
    },
    {
      "frame": 161,
      "do": "fireUp"
    },
    {
      "frame": 175,
      "do": "fire"
    },
    {
      "frame": 176,
      "do": "fireUp"
    }
  ],
  "repeats": 2,
  "measure": {
    "shots": {}
  },
  "covers": [
    "uc:SBase.SPlayerController:Fire",
    "uc:SBase.SWeaponDefense:FireWeapon",
    "uc:SBase.SWeaponDefense:ServerFireWeapon",
    "uc:SBase.SWeaponDefense:TraceFire",
    "nat:Engine.Actor.TraceBone",
    "nat:SBase.SWeaponDefense.GetAccuracy",
    "uc:SBase.SPlayerController:StandardReactionsToDamage",
    "uc:SBase.SPlayerController:PawnTakeDamage",
    "uc:SBase.SWeaponDefense:ApplyWeaponJump"
  ],
  "spot": "SteeE east yard lane (x -492, floor z -1143.5, clear for 1792 uu along +Y from y -2032; found with re/tools/difftest/spots.py for the R4 locomotion recordings)"
}
